{
    "operationName": "accountMetrics",
    "query": "query accountMetrics ( $toRate:Boolean $perSecond:Boolean $withMissingData:Boolean $useDefaultSizeBucket:Boolean $buckets:Int $labels:[TimeseriesMetricType!] $types:[String!] $siteIDs:[ID!] $userIDs:[ID!] $timeFrame:TimeFrame! $groupInterfaces:Boolean $groupDevices:Boolean ) {\n\taccountMetrics ( timeFrame:$timeFrame groupInterfaces:$groupInterfaces groupDevices:$groupDevices ) {\n\t\tid\n\t\tfrom\n\t\tto\n\t\tgranularity\n\t\tsites ( siteIDs:$siteIDs  )  {\n\t\t\tid\n\t\t\tinterfaceMetricsInterfaces: interfaces {\n\t\t\t\tmetricsMetrics: metrics ( toRate:$toRate  )  {\n\t\t\t\t\tduration\n\t\t\t\t\tgranularity\n\t\t\t\t\tbytesDownstream\n\t\t\t\t\tbytesUpstream\n\t\t\t\t\tbytesTotal\n\t\t\t\t\tlostDownstream\n\t\t\t\t\tlostDownstreamPcnt\n\t\t\t\t\tlostUpstream\n\t\t\t\t\tlostUpstreamPcnt\n\t\t\t\t\tpacketsDownstream\n\t\t\t\t\tpacketsUpstream\n\t\t\t\t\tjitterUpstream\n\t\t\t\t\tjitterDownstream\n\t\t\t\t\tpacketsDiscardedDownstream\n\t\t\t\t\tpacketsDiscardedUpstream\n\t\t\t\t\trtt\n\t\t\t\t\thostCount\n\t\t\t\t\thostLimit\n\t\t\t\t\tflowCount\n\t\t\t\t}\n\n\t\t\t\tname\n\t\t\t\ttimeseriesTimeseries: timeseries ( buckets:$buckets  labels:$labels  )  {\n\t\t\t\t\tdata ( perSecond:$perSecond  withMissingData:$withMissingData  useDefaultSizeBucket:$useDefaultSizeBucket   )\n\t\t\t\t\tlabel\n\t\t\t\t\tdimensionDataDimensions: dimensions {\n\t\t\t\t\t\tlabel\n\t\t\t\t\t\tvalue\n\t\t\t\t\t}\n\t\t\t\t\ttimeseriesKeyKey: key {\n\t\t\t\t\t\tmeasureFieldName\n\t\t\t\t\t\tdimensions {\n\t\t\t\t\t\t\tfieldName\n\t\t\t\t\t\t\tvalue\n\t\t\t\t\t\t}\n\n\t\t\t\t\t}\n\t\t\t\t\tsum\n\t\t\t\t\tunitTypeUnits: units\n\t\t\t\t\tinfo\n\t\t\t\t}\n\n\t\t\t\ttimeAnnotationAnnotations: annotations ( types:$types  )  {\n\t\t\t\t\ttime\n\t\t\t\t\tlabel\n\t\t\t\t\tshortLabel\n\t\t\t\t\tannotationTypeType: type\n\t\t\t\t}\n\n\t\t\t\ttimePeriodPeriods: periods {\n\t\t\t\t\tduration\n\t\t\t\t\ttitle\n\t\t\t\t\tperiodTypeType: type\n\t\t\t\t}\n\n\t\t\t\tiPInfoRemoteIPInfo: remoteIPInfo {\n\t\t\t\t\tip\n\t\t\t\t\tcountryCode\n\t\t\t\t\tcountryName\n\t\t\t\t\tcity\n\t\t\t\t\tstate\n\t\t\t\t\tprovider\n\t\t\t\t\tlatitude\n\t\t\t\t\tlongitude\n\t\t\t\t}\n\n\t\t\t\tremoteIP\n\t\t\t\tsocketInfoSocketInfo: socketInfo {\n\t\t\t\t\tid\n\t\t\t\t\tserial\n\t\t\t\t\tisPrimary\n\t\t\t\t\tplatform\n\t\t\t\t\tversion\n\t\t\t\t\tversionUpdateTime\n\t\t\t\t}\n\n\t\t\t\tiPSecInfoIpsecInfo: ipsecInfo {\n\t\t\t\t\tisPrimary\n\t\t\t\t\tcatoIP\n\t\t\t\t\tremoteIP\n\t\t\t\t\tikeVersion\n\t\t\t\t}\n\n\t\t\t\tinterfaceInfoInterfaceInfo: interfaceInfo {\n\t\t\t\t\tid\n\t\t\t\t\tname\n\t\t\t\t\tupstreamBandwidth\n\t\t\t\t\tdownstreamBandwidth\n\t\t\t\t\tupstreamBandwidthMbpsPrecision\n\t\t\t\t\tdownstreamBandwidthMbpsPrecision\n\t\t\t\t\tdestType\n\t\t\t\t\twanRole\n\t\t\t\t}\n\n\t\t\t}\n\t\t\tmetricsMetrics: metrics ( toRate:$toRate   ) {\n\t\t\t\tduration\n\t\t\t\tgranularity\n\t\t\t\tbytesDownstream\n\t\t\t\tbytesUpstream\n\t\t\t\tbytesTotal\n\t\t\t\tlostDownstream\n\t\t\t\tlostDownstreamPcnt\n\t\t\t\tlostUpstream\n\t\t\t\tlostUpstreamPcnt\n\t\t\t\tpacketsDownstream\n\t\t\t\tpacketsUpstream\n\t\t\t\tjitterUpstream\n\t\t\t\tjitterDownstream\n\t\t\t\tpacketsDiscardedDownstream\n\t\t\t\tpacketsDiscardedUpstream\n\t\t\t\trtt\n\t\t\t\thostCount\n\t\t\t\thostLimit\n\t\t\t\tflowCount\n\t\t\t}\n\t\t\tname\n\t\t\tsiteInfoInfo: info {\n\t\t\t\tname\n\t\t\t\ttype\n\t\t\t\tdescription\n\t\t\t\tcountryCode\n\t\t\t\tregion\n\t\t\t\tcountryName\n\t\t\t\tcountryStateName\n\t\t\t\tcityName\n\t\t\t\taddress\n\t\t\t\tisHA\n\t\t\t\tconnType\n\t\t\t\tcreationTime\n\t\t\t\tinterfaces {\n\t\t\t\t\tid\n\t\t\t\t\tname\n\t\t\t\t\tupstreamBandwidth\n\t\t\t\t\tdownstreamBandwidth\n\t\t\t\t\tupstreamBandwidthMbpsPrecision\n\t\t\t\t\tdownstreamBandwidthMbpsPrecision\n\t\t\t\t\tdestType\n\t\t\t\t\tsocketInterfaceWanRoleWanRole: wanRole\n\t\t\t\t}\n\n\t\t\t\tsockets {\n\t\t\t\t\tid\n\t\t\t\t\tserial\n\t\t\t\t\tisPrimary\n\t\t\t\t\tsocketPlatformPlatform: platform\n\t\t\t\t\tversion\n\t\t\t\t\tversionUpdateTime\n\t\t\t\t}\n\n\t\t\t\tipsec {\n\t\t\t\t\tisPrimary\n\t\t\t\t\tcatoIP\n\t\t\t\t\tremoteIP\n\t\t\t\t\tikeVersion\n\t\t\t\t}\n\n\t\t\t}\n\t\t\ttimeseriesHostCount: hostCount {\n\t\t\t\tdata ( perSecond:$perSecond  withMissingData:$withMissingData  useDefaultSizeBucket:$useDefaultSizeBucket  ) \n\t\t\t\tlabel\n\t\t\t\tdimensions {\n\t\t\t\t\tlabel\n\t\t\t\t\tvalue\n\t\t\t\t}\n\n\t\t\t\tkey {\n\t\t\t\t\tmeasureFieldName\n\t\t\t\t\tdimensions {\n\t\t\t\t\t\tfieldName\n\t\t\t\t\t\tvalue\n\t\t\t\t\t}\n\t\t\t\t}\n\n\t\t\t\tsum\n\t\t\t\tunits\n\t\t\t\tinfo\n\t\t\t}\n\t\t\ttimeseriesFlowCount: flowCount {\n\t\t\t\tdata ( perSecond:$perSecond  withMissingData:$withMissingData  useDefaultSizeBucket:$useDefaultSizeBucket  ) \n\t\t\t\tlabel\n\t\t\t\tdimensions {\n\t\t\t\t\tlabel\n\t\t\t\t\tvalue\n\t\t\t\t}\n\n\t\t\t\tkey {\n\t\t\t\t\tmeasureFieldName\n\t\t\t\t\tdimensions {\n\t\t\t\t\t\tfieldName\n\t\t\t\t\t\tvalue\n\t\t\t\t\t}\n\t\t\t\t}\n\n\t\t\t\tsum\n\t\t\t\tunits\n\t\t\t\tinfo\n\t\t\t}\n\t\t\ttimeseriesHostLimit: hostLimit {\n\t\t\t\tdata ( perSecond:$perSecond  withMissingData:$withMissingData  useDefaultSizeBucket:$useDefaultSizeBucket  ) \n\t\t\t\tlabel\n\t\t\t\tdimensions {\n\t\t\t\t\tlabel\n\t\t\t\t\tvalue\n\t\t\t\t}\n\n\t\t\t\tkey {\n\t\t\t\t\tmeasureFieldName\n\t\t\t\t\tdimensions {\n\t\t\t\t\t\tfieldName\n\t\t\t\t\t\tvalue\n\t\t\t\t\t}\n\t\t\t\t}\n\n\t\t\t\tsum\n\t\t\t\tunits\n\t\t\t\tinfo\n\t\t\t}\n\t\t\tsamples\n\t\t}\n\n\t\tusers ( userIDs:$userIDs  )  {\n\t\t\tid\n\t\t\tinterfaceMetricsInterfaces: interfaces {\n\t\t\t\tmetricsMetrics: metrics ( toRate:$toRate  )  {\n\t\t\t\t\tduration\n\t\t\t\t\tgranularity\n\t\t\t\t\tbytesDownstream\n\t\t\t\t\tbytesUpstream\n\t\t\t\t\tbytesTotal\n\t\t\t\t\tlostDownstream\n\t\t\t\t\tlostDownstreamPcnt\n\t\t\t\t\tlostUpstream\n\t\t\t\t\tlostUpstreamPcnt\n\t\t\t\t\tpacketsDownstream\n\t\t\t\t\tpacketsUpstream\n\t\t\t\t\tjitterUpstream\n\t\t\t\t\tjitterDownstream\n\t\t\t\t\tpacketsDiscardedDownstream\n\t\t\t\t\tpacketsDiscardedUpstream\n\t\t\t\t\trtt\n\t\t\t\t\thostCount\n\t\t\t\t\thostLimit\n\t\t\t\t\tflowCount\n\t\t\t\t}\n\n\t\t\t\tname\n\t\t\t\ttimeseriesTimeseries: timeseries ( buckets:$buckets  labels:$labels  )  {\n\t\t\t\t\tdata ( perSecond:$perSecond  withMissingData:$withMissingData  useDefaultSizeBucket:$useDefaultSizeBucket   )\n\t\t\t\t\tlabel\n\t\t\t\t\tdimensionDataDimensions: dimensions {\n\t\t\t\t\t\tlabel\n\t\t\t\t\t\tvalue\n\t\t\t\t\t}\n\t\t\t\t\ttimeseriesKeyKey: key {\n\t\t\t\t\t\tmeasureFieldName\n\t\t\t\t\t\tdimensions {\n\t\t\t\t\t\t\tfieldName\n\t\t\t\t\t\t\tvalue\n\t\t\t\t\t\t}\n\n\t\t\t\t\t}\n\t\t\t\t\tsum\n\t\t\t\t\tunitTypeUnits: units\n\t\t\t\t\tinfo\n\t\t\t\t}\n\n\t\t\t\ttimeAnnotationAnnotations: annotations ( types:$types  )  {\n\t\t\t\t\ttime\n\t\t\t\t\tlabel\n\t\t\t\t\tshortLabel\n\t\t\t\t\tannotationTypeType: type\n\t\t\t\t}\n\n\t\t\t\ttimePeriodPeriods: periods {\n\t\t\t\t\tduration\n\t\t\t\t\ttitle\n\t\t\t\t\tperiodTypeType: type\n\t\t\t\t}\n\n\t\t\t\tiPInfoRemoteIPInfo: remoteIPInfo {\n\t\t\t\t\tip\n\t\t\t\t\tcountryCode\n\t\t\t\t\tcountryName\n\t\t\t\t\tcity\n\t\t\t\t\tstate\n\t\t\t\t\tprovider\n\t\t\t\t\tlatitude\n\t\t\t\t\tlongitude\n\t\t\t\t}\n\n\t\t\t\tremoteIP\n\t\t\t\tsocketInfoSocketInfo: socketInfo {\n\t\t\t\t\tid\n\t\t\t\t\tserial\n\t\t\t\t\tisPrimary\n\t\t\t\t\tplatform\n\t\t\t\t\tversion\n\t\t\t\t\tversionUpdateTime\n\t\t\t\t}\n\n\t\t\t\tiPSecInfoIpsecInfo: ipsecInfo {\n\t\t\t\t\tisPrimary\n\t\t\t\t\tcatoIP\n\t\t\t\t\tremoteIP\n\t\t\t\t\tikeVersion\n\t\t\t\t}\n\n\t\t\t\tinterfaceInfoInterfaceInfo: interfaceInfo {\n\t\t\t\t\tid\n\t\t\t\t\tname\n\t\t\t\t\tupstreamBandwidth\n\t\t\t\t\tdownstreamBandwidth\n\t\t\t\t\tupstreamBandwidthMbpsPrecision\n\t\t\t\t\tdownstreamBandwidthMbpsPrecision\n\t\t\t\t\tdestType\n\t\t\t\t\twanRole\n\t\t\t\t}\n\n\t\t\t}\n\t\t\tmetricsMetrics: metrics ( toRate:$toRate   ) {\n\t\t\t\tduration\n\t\t\t\tgranularity\n\t\t\t\tbytesDownstream\n\t\t\t\tbytesUpstream\n\t\t\t\tbytesTotal\n\t\t\t\tlostDownstream\n\t\t\t\tlostDownstreamPcnt\n\t\t\t\tlostUpstream\n\t\t\t\tlostUpstreamPcnt\n\t\t\t\tpacketsDownstream\n\t\t\t\tpacketsUpstream\n\t\t\t\tjitterUpstream\n\t\t\t\tjitterDownstream\n\t\t\t\tpacketsDiscardedDownstream\n\t\t\t\tpacketsDiscardedUpstream\n\t\t\t\trtt\n\t\t\t\thostCount\n\t\t\t\thostLimit\n\t\t\t\tflowCount\n\t\t\t}\n\t\t\tname\n\t\t\tsiteInfoInfo: info {\n\t\t\t\tname\n\t\t\t\ttype\n\t\t\t\tdescription\n\t\t\t\tcountryCode\n\t\t\t\tregion\n\t\t\t\tcountryName\n\t\t\t\tcountryStateName\n\t\t\t\tcityName\n\t\t\t\taddress\n\t\t\t\tisHA\n\t\t\t\tconnType\n\t\t\t\tcreationTime\n\t\t\t\tinterfaces {\n\t\t\t\t\tid\n\t\t\t\t\tname\n\t\t\t\t\tupstreamBandwidth\n\t\t\t\t\tdownstreamBandwidth\n\t\t\t\t\tupstreamBandwidthMbpsPrecision\n\t\t\t\t\tdownstreamBandwidthMbpsPrecision\n\t\t\t\t\tdestType\n\t\t\t\t\tsocketInterfaceWanRoleWanRole: wanRole\n\t\t\t\t}\n\n\t\t\t\tsockets {\n\t\t\t\t\tid\n\t\t\t\t\tserial\n\t\t\t\t\tisPrimary\n\t\t\t\t\tsocketPlatformPlatform: platform\n\t\t\t\t\tversion\n\t\t\t\t\tversionUpdateTime\n\t\t\t\t}\n\n\t\t\t\tipsec {\n\t\t\t\t\tisPrimary\n\t\t\t\t\tcatoIP\n\t\t\t\t\tremoteIP\n\t\t\t\t\tikeVersion\n\t\t\t\t}\n\n\t\t\t}\n\t\t\ttimeseriesHostCount: hostCount {\n\t\t\t\tdata ( perSecond:$perSecond  withMissingData:$withMissingData  useDefaultSizeBucket:$useDefaultSizeBucket  ) \n\t\t\t\tlabel\n\t\t\t\tdimensions {\n\t\t\t\t\tlabel\n\t\t\t\t\tvalue\n\t\t\t\t}\n\n\t\t\t\tkey {\n\t\t\t\t\tmeasureFieldName\n\t\t\t\t\tdimensions {\n\t\t\t\t\t\tfieldName\n\t\t\t\t\t\tvalue\n\t\t\t\t\t}\n\t\t\t\t}\n\n\t\t\t\tsum\n\t\t\t\tunits\n\t\t\t\tinfo\n\t\t\t}\n\t\t\ttimeseriesFlowCount: flowCount {\n\t\t\t\tdata ( perSecond:$perSecond  withMissingData:$withMissingData  useDefaultSizeBucket:$useDefaultSizeBucket  ) \n\t\t\t\tlabel\n\t\t\t\tdimensions {\n\t\t\t\t\tlabel\n\t\t\t\t\tvalue\n\t\t\t\t}\n\n\t\t\t\tkey {\n\t\t\t\t\tmeasureFieldName\n\t\t\t\t\tdimensions {\n\t\t\t\t\t\tfieldName\n\t\t\t\t\t\tvalue\n\t\t\t\t\t}\n\t\t\t\t}\n\n\t\t\t\tsum\n\t\t\t\tunits\n\t\t\t\tinfo\n\t\t\t}\n\t\t\ttimeseriesHostLimit: hostLimit {\n\t\t\t\tdata ( perSecond:$perSecond  withMissingData:$withMissingData  useDefaultSizeBucket:$useDefaultSizeBucket  ) \n\t\t\t\tlabel\n\t\t\t\tdimensions {\n\t\t\t\t\tlabel\n\t\t\t\t\tvalue\n\t\t\t\t}\n\n\t\t\t\tkey {\n\t\t\t\t\tmeasureFieldName\n\t\t\t\t\tdimensions {\n\t\t\t\t\t\tfieldName\n\t\t\t\t\t\tvalue\n\t\t\t\t\t}\n\t\t\t\t}\n\n\t\t\t\tsum\n\t\t\t\tunits\n\t\t\t\tinfo\n\t\t\t}\n\t\t\tsamples\n\t\t}\n\n\t\ttimeseries ( labels:$labels  buckets:$buckets  )  {\n\t\t\tdata ( perSecond:$perSecond  withMissingData:$withMissingData  useDefaultSizeBucket:$useDefaultSizeBucket   )\n\t\t\tlabel\n\t\t\tdimensionDataDimensions: dimensions {\n\t\t\t\tlabel\n\t\t\t\tvalue\n\t\t\t}\n\t\t\ttimeseriesKeyKey: key {\n\t\t\t\tmeasureFieldName\n\t\t\t\tdimensions {\n\t\t\t\t\tfieldName\n\t\t\t\t\tvalue\n\t\t\t\t}\n\n\t\t\t}\n\t\t\tsum\n\t\t\tunitTypeUnits: units\n\t\t\tinfo\n\t\t}\n\n\t}\t\n}",
    "variables": {
        "buckets": "Int",
        "groupDevices": "Boolean",
        "groupInterfaces": "Boolean",
        "labels": "enum(TimeseriesMetricType)",
        "perSecond": "Boolean",
        "siteIDs": [
            "ID"
        ],
        "timeFrame": "TimeFrame",
        "toRate": "Boolean",
        "types": [
            "String"
        ],
        "useDefaultSizeBucket": "Boolean",
        "userIDs": [
            "ID"
        ],
        "withMissingData": "Boolean"
    }
}